{
  "track_id": "double-diamond-party-mode_20241223",
  "type": "feature",
  "status": "new",
  "priority": "high",
  "depends_on": [],
  "estimated_hours": 8,
  "created_at": "2024-12-23T00:00:00Z",
  "updated_at": "2024-12-23T00:00:00Z",
  "description": "Enhance /conductor:design with Double Diamond methodology and multi-agent Party Mode for collaborative design sessions"
}
